post_url,comment_id,text,timestamp,likes,username,lang,region
https://www.instagram.com/p/C9TgmWayIWL/,18034897256018531,Why are you spanking yourself?,2024-07-18T17:14:14.000Z,0,dylanmo13,en,US
https://www.instagram.com/p/C9TgmWayIWL/,18049985140749934,Why take your shoes,2024-07-18T15:53:40.000Z,0,jotapebmw,en,US
https://www.instagram.com/p/DSobwtFDgpn/,18433438861107200,What is the name of the first pair of leggings from Lulu? Thanks.,2026-01-06T06:07:00.000Z,0,poshelle,en,US
https://www.instagram.com/p/DSobwtFDgpn/,18124942192549546,@realawee🔗,2026-01-06T01:16:03.000Z,0,laweerea,en,US
https://www.instagram.com/p/DSobwtFDgpn/,17906544915336442,Me please,2026-01-06T01:11:48.000Z,0,gillian_z3,en,US
https://www.instagram.com/p/C9TgmWayIWL/,18035361590008387,How many kilos the kettlebell here ?,2024-07-18T14:53:34.000Z,0,thelibertarianlaboheme,en,US
https://www.instagram.com/p/C9TgmWayIWL/,18024808229257914,"Not so hygienic, but nice Feet!",2024-07-18T14:52:07.000Z,0,alexanderhoffmeister,en,US
https://www.instagram.com/p/C9TgmWayIWL/,17852264019237074,Put shoes on.  Disgusting,2024-07-18T14:18:10.000Z,0,dannellenwood,en,US
https://www.instagram.com/p/C9TgmWayIWL/,17871222036085391,She wants atention… omg,2024-07-18T14:03:21.000Z,0,kristijanbenzon97,en,US
https://www.instagram.com/p/C9TgmWayIWL/,18056147437654385,People are right to interrupt you and ask you to put your shoes back on,2024-07-18T13:06:02.000Z,0,bushwahhh91,en,US
https://www.instagram.com/p/C9TgmWayIWL/,18003221798383048,She knows how to use the algorithm 🦶,2024-07-18T12:57:27.000Z,24,wes89651,en,US
https://www.instagram.com/p/C9TgmWayIWL/,18119513530374808,First time doing these? I can't see any result on you,2024-07-18T12:54:39.000Z,0,sszabodavid,en,US
https://www.instagram.com/p/C9TgmWayIWL/,17931465527871484,Barefoot… 🤦‍♂️ people way too comfortable these days,2024-07-18T12:45:01.000Z,0,lukeybets,en,US
https://www.instagram.com/p/DSobwtFDgpn/,18034865180542431,What’s most notable about these is the huge gap between your legs what is that about?,2026-01-06T00:35:51.000Z,0,billsmith4418,en,US
https://www.instagram.com/p/DSobwtFDgpn/,17880168096356225,The polka dots!!,2026-01-05T13:09:44.000Z,0,kristinatasca,en,US
https://www.instagram.com/p/C9TgmWayIWL/,18047908183863349,You can tell everyone’s annoyed but she probably thinks everyone staring at her hoping for a shot😂,2024-07-18T11:09:40.000Z,0,meldac13,en,US
https://www.instagram.com/p/C9TgmWayIWL/,17891164343981877,I think she’s trying to be sexual it’s not just a workout … the socks would have achieved the same effect as they have no support.,2024-07-18T11:06:53.000Z,6,jourdan._alexander,en,US
https://www.instagram.com/p/C9TgmWayIWL/,18113210809389035,Ban filming in the gym,2024-07-18T10:57:55.000Z,0,alexander_hartdegen,en,US
https://www.instagram.com/p/C9TgmWayIWL/,18266386531246380,"These people must go there for attention, if I was a so called “influencer” I’d build a home gym and use that as my studio/office… why do this in public",2024-07-18T10:55:51.000Z,0,lwnew,en,US
https://www.instagram.com/p/C9TgmWayIWL/,18441563836028987,"having trouble comprehending how many people are upset about her feet.. if ur grossed out by a clean, beautiful woman's feet then wait til you hear how you were born 😂",2024-07-18T10:51:06.000Z,0,bosworth13,en,US
https://www.instagram.com/p/C9TgmWayIWL/,18015646235593922,Does the ppl in Gym agree that you put them into the Internet?,2024-07-18T10:35:21.000Z,0,sam_midaw,en,US
https://www.instagram.com/p/C9TgmWayIWL/,18055802737655679,Work out wothout shoooo😂,2024-07-18T10:08:11.000Z,0,evtehran2,en,US
https://www.instagram.com/p/C9TgmWayIWL/,18450543625020129,Bare foot in the gym !!! She shud be kicked out,2024-07-18T09:32:15.000Z,0,33lip_s,en,US
https://www.instagram.com/p/DSobwtFDgpn/,18107090842661272,Yes please! Polka dot is my fave too,2026-01-05T05:21:15.000Z,0,ali.whiteside,en,US
https://www.instagram.com/p/DSobwtFDgpn/,18520286221067122,Boots link please!,2026-01-05T03:59:33.000Z,0,shan.curt,en,US
https://www.instagram.com/p/C9TgmWayIWL/,17947743317712385,Thanks for filming this unique experience that non of us have seen before e,2024-07-18T09:01:16.000Z,0,aidangre,en,US
https://www.instagram.com/p/C9TgmWayIWL/,17859706767197403,Put socks on you scruff,2024-07-18T08:49:56.000Z,0,tedrg,en,US
https://www.instagram.com/p/C9TgmWayIWL/,18003801200374716,"Imagine if someone stepped on infected dog shit and came to the gym without changing their shoes. I mean, if you don’t follow the rule of using clean shoes (in fact you don’t), others might too. Either way, your cute little feet would be touching a shit-stained surface. I wouldn’t like it. 🥸",2024-07-18T08:42:16.000Z,0,unaltromotociclista,en,US
https://www.instagram.com/p/C9TgmWayIWL/,18014490515224377,Put your smelly dirty feet away,2024-07-18T08:17:42.000Z,0,ericisdeaddd,en,US
https://www.instagram.com/p/C9TgmWayIWL/,18037696768991765,Training without socks on in the gym is fucking disgusting.,2024-07-18T07:54:28.000Z,0,sebastian_luke_mitchell,en,US
https://www.instagram.com/p/C9TgmWayIWL/,17947789793817972,Barefoot at the gym… like it 🤓😏,2024-07-18T07:33:26.000Z,0,philipjacobs_,en,US
https://www.instagram.com/p/C9TgmWayIWL/,17873459376111728,"Still flat, stop with all the nonsense and lift heavy",2024-07-18T07:27:31.000Z,0,jds5k,en,US
https://www.instagram.com/p/C9TgmWayIWL/,18050868457700574,Ringworm entered the chat,2024-07-18T05:53:51.000Z,0,liz.harlan,en,US
https://www.instagram.com/p/C9TgmWayIWL/,17952858389804023,Save your spine by the second movement shown.,2024-07-18T04:38:14.000Z,0,rikybologna,en,US
https://www.instagram.com/p/C9TgmWayIWL/,18046418380721843,Bare feet  is absolutely  fine .. just don’t listen to these Bobos @kathevansfit 👍,2024-07-18T03:35:46.000Z,0,mehuldarooka,en,US
https://www.instagram.com/p/DSobwtFDgpn/,18549744148031989,Link please,2026-01-05T02:05:16.000Z,0,stephtoch,en,US
https://www.instagram.com/p/DSobwtFDgpn/,18004874921685153,Fellas who's here because of... Well you know.😂,2026-01-04T23:56:13.000Z,0,pyro_zx6r,en,US
https://www.instagram.com/p/DSobwtFDgpn/,18099741007875095,Link please,2026-01-04T21:51:50.000Z,0,lindseychropka,en,US
https://www.instagram.com/p/DSobwtFDgpn/,18062632160259754,"Love all items, please send me links",2026-01-04T21:19:13.000Z,0,josiemarsala,en,US
https://www.instagram.com/p/C9TgmWayIWL/,17976101072724650,Sweaty feets 🤮,2024-07-18T03:26:29.000Z,0,parkpicasso.tr,en,US
https://www.instagram.com/p/C9TgmWayIWL/,18039278086820464,"gyms don’t allow no shoes. also super dangerous. if the weight fell on your foot and yes, not to mention ring worm 🤮",2024-07-18T02:52:13.000Z,0,shelbyroselaganelli,en,US
https://www.instagram.com/p/C9TgmWayIWL/,18084395779484484,Powerful 💥,2024-07-18T02:14:39.000Z,2,markus.landscapes,en,US
https://www.instagram.com/p/C9TgmWayIWL/,18239006110258529,If u want to record at the gym then buy one! Why are your shoes and socks off? 🤡,2024-07-18T00:21:38.000Z,0,davferg10,en,US
https://www.instagram.com/p/C9TgmWayIWL/,18008265323328821,Keep your camera 📸 at home and show people there.. your bothering others,2024-07-17T23:11:59.000Z,0,keith.sweeney.16,en,US
https://www.instagram.com/p/C9TgmWayIWL/,18056338969648892,Some women r nasty at the gym,2024-07-17T23:03:48.000Z,0,thirtyoneseventyfive,en,US
https://www.instagram.com/p/DSobwtFDgpn/,18108747439725499,Yes please,2026-01-04T17:51:42.000Z,0,hollyapryor,en,US
https://www.instagram.com/p/DSobwtFDgpn/,18310673500267916,The shoes 😍😍😍,2026-01-04T16:14:52.000Z,0,alexvmalek,en,US
https://www.instagram.com/p/C9TgmWayIWL/,18038569624838047,The entitlement is crazy,2024-07-17T22:28:15.000Z,0,trej2,en,US
https://www.instagram.com/p/C9TgmWayIWL/,18115427842379767,Why barefoot?,2024-07-17T22:07:48.000Z,0,anthony.gobert.1980,en,US
https://www.instagram.com/p/C9TgmWayIWL/,17978057303715984,i hate feet. if i go to the gym and see this i’m pulling my first karen🤣🤣🤣,2024-07-17T21:37:09.000Z,5,baluvidd,en,US
https://www.instagram.com/p/C9TgmWayIWL/,18130292428317422,Why is the gym allowing no socks on 🤢,2024-07-17T21:07:24.000Z,0,mimilafran,en,US
https://www.instagram.com/p/C9TgmWayIWL/,18026577608033374,Anyone who goes to a gym shoeless should be arrested@,2024-07-17T20:59:36.000Z,0,_.j215a._,en,US
https://www.instagram.com/p/C9TgmWayIWL/,18063424459597864,"Barefoot at the gym, I can hear the song now athlete's foot here I come.... 🤦🏾‍♂️🤷🏾‍♂️",2024-07-17T20:56:05.000Z,2,in_ink_i_trust_77,en,US
https://www.instagram.com/p/C9TgmWayIWL/,18027345218185989,Why would you do this barefoot in a gym. I think maybe this isn't about working out is it,2024-07-17T20:31:55.000Z,0,vibin.with.rob,en,US
https://www.instagram.com/p/C9TgmWayIWL/,18237493105281079,People that film in gyms are narcissists,2024-07-17T20:29:16.000Z,0,parallel_exposure,en,US
https://www.instagram.com/p/C9TgmWayIWL/,18046865176710415,She would never get in my bed with those things🤮,2024-07-17T20:24:10.000Z,0,adamxdorsett,en,US
https://www.instagram.com/p/C9TgmWayIWL/,18441784168046866,Why are people posting vids of this..ego meed a massage,2024-07-17T20:23:15.000Z,0,funky_discotee,en,US
https://www.instagram.com/p/C9TgmWayIWL/,18041129956769637,"hate barefeet in the gym, unless you're a pretty blonde,  then its fine. otherwise 🤮🤮",2024-07-17T20:10:41.000Z,0,machine_kid1,en,US
https://www.instagram.com/p/C9TgmWayIWL/,18344431438141765,Who watches this shit and why?,2024-07-17T19:08:32.000Z,0,kiss_me_and_tell_me_lies,en,US
https://www.instagram.com/p/C9TgmWayIWL/,18054640171661209,Just start sleeping with all the men there honey. You look like you need attention,2024-07-17T18:49:18.000Z,0,eichenzorn,en,US
https://www.instagram.com/p/C9TgmWayIWL/,18040454854784757,Nice feet but in a public gym🤷,2024-07-17T18:48:42.000Z,0,highgear_145,en,US
https://www.instagram.com/p/DSobwtFDgpn/,18330986185212963,🔗 Please,2026-01-04T03:21:42.000Z,0,pippylng,en,US
https://www.instagram.com/p/DSobwtFDgpn/,18090937928482026,Love the shoes,2026-01-04T00:31:29.000Z,0,bba.rb918,en,US
https://www.instagram.com/p/DSobwtFDgpn/,18547438741017495,Yes please!!,2026-01-03T23:02:30.000Z,0,lethanhpetrov,en,US
https://www.instagram.com/p/DSobwtFDgpn/,17889475032408795,@whitney_edlund,2026-01-03T22:15:09.000Z,0,whitney_edlund,en,US
https://www.instagram.com/p/DSobwtFDgpn/,17987292332919882,🔗 please,2026-01-03T14:05:43.000Z,0,mandys3boys,en,US
https://www.instagram.com/p/DSobwtFDgpn/,17905895424305885,Emily,2026-01-03T13:33:15.000Z,0,emily.hurley001,en,US
https://www.instagram.com/p/C9TgmWayIWL/,17854560864227636,Bare feet in the gym? You should be kicked out that’s unsanitary.,2024-07-17T18:01:55.000Z,0,davelangfield,en,US
https://www.instagram.com/p/C9TgmWayIWL/,18007169501617215,"Hand, foot, and mouth disease is alive and well.🫡",2024-07-17T17:52:57.000Z,0,house_of_hammyi,en,US
https://www.instagram.com/p/C9TgmWayIWL/,17935088021855379,The narcissism is why you don’t see a ring on it,2024-07-17T17:51:48.000Z,0,seagull2244,en,US
https://www.instagram.com/p/C9TgmWayIWL/,18073308028472333,🙋🏾‍♂️the men who are going to find a reason to walk behind her while her sole is turned up on that bench button. 🤷🏾‍♂️———->,2024-07-17T17:46:32.000Z,0,5555bigdude,en,US
https://www.instagram.com/p/C9TgmWayIWL/,18147674998320798,Grandpa with TN 💀,2024-07-17T17:46:13.000Z,0,beto_wwhitee,en,US
https://www.instagram.com/p/C9TgmWayIWL/,18239981731260712,Good work on progress but I feel like I stick to science anyway,2024-07-17T17:43:50.000Z,0,stepanek_sy,en,US
https://www.instagram.com/p/C9TgmWayIWL/,18032057612115900,"How about turn off your camera and your light, your tripod and everything else and just work out and stop interrupting other peoples workouts",2024-07-17T17:43:37.000Z,0,22deano,en,US
https://www.instagram.com/p/C9TgmWayIWL/,18012807203254785,No me smelling the bench and box after you left 😅,2024-07-17T17:39:41.000Z,0,yj_bohon,en,US
https://www.instagram.com/p/C9TgmWayIWL/,18013245149443321,Disgusting 🤮 put sone socks brah,2024-07-17T17:22:17.000Z,0,iversonc93,en,US
https://www.instagram.com/p/C9TgmWayIWL/,18419909914068099,Thanks for not having a huge ass.,2024-07-17T16:50:06.000Z,0,brianrc11,en,US
https://www.instagram.com/p/DSobwtFDgpn/,17996630048852029,Love it all!!!!,2026-01-03T03:54:54.000Z,0,sarrisaharris,en,US
https://www.instagram.com/p/C9TgmWayIWL/,17917591130868333,Ban recording in the gym,2024-07-17T15:48:16.000Z,0,tony.se7en,en,US
https://www.instagram.com/p/C9TgmWayIWL/,18039057349967570,Btw why are you slapping your own ass? Lol,2024-07-17T15:44:23.000Z,0,st.efann,en,US
https://www.instagram.com/p/C9TgmWayIWL/,18034044161499420,"Barefoot in the gym is not a problem. What is a problem are people that wear the same gym clothes for I dunno months and smell like a dead body, or how about the creeps that sweat all over the equipment and walk off leaving their crud for the next person, or how about the people that wear their GD street shoes covered in crud into the sauna. Someone who slips off their shoes to do a couple sets of floor exercises like this lady. I’ll take that any day.",2024-07-17T14:03:30.000Z,4,tushka054,en,US
https://www.instagram.com/p/C9TgmWayIWL/,17946960296822485,Stop filming in the gym 🤦‍♂️,2024-07-17T13:57:34.000Z,0,anpmech_man,en,US
https://www.instagram.com/p/C9TgmWayIWL/,17979546545579201,Can you go barefoot in a public gym?,2024-07-17T13:44:44.000Z,0,thearkhamartist,en,US
https://www.instagram.com/p/C9TgmWayIWL/,18141342586327995,Possible shoe?,2024-07-17T12:52:07.000Z,0,schontamas,en,US
https://www.instagram.com/p/DSobwtFDgpn/,18066698876408686,Love the boots!,2026-01-03T00:18:46.000Z,0,lauren.yournorthgarealtor,en,US
https://www.instagram.com/p/DSobwtFDgpn/,18085441388115242,What are the first pants !?,2026-01-02T18:25:03.000Z,0,amandaaa.christine,en,US
https://www.instagram.com/p/DSobwtFDgpn/,18062489510267182,Love everything 🔗😍 please send 🔗 link,2026-01-02T13:28:28.000Z,0,blowmeup_hairstyle,en,US
https://www.instagram.com/p/DSobwtFDgpn/,17843950050658075,Link for all!,2026-01-02T05:31:03.000Z,0,britthertko,en,US
https://www.instagram.com/p/C9TgmWayIWL/,18002757926399492,No socks.. clout,2024-07-17T12:36:22.000Z,0,l3wis.callum,en,US
https://www.instagram.com/p/C9TgmWayIWL/,18000325286641945,I’m not trying to troll but why take shoes and socks off?,2024-07-17T12:11:40.000Z,0,master_tuf,en,US
https://www.instagram.com/p/C9TgmWayIWL/,18029518802145919,Let's focus more on this girls 0.0% body fat and crazy superhero muscles .,2024-07-17T12:08:40.000Z,0,officialmikeholman,en,US
https://www.instagram.com/p/C9TgmWayIWL/,18330529987121581,"Maybe if you did hip extension based lifts which is what works your glutes, your glutes would grow oppose to doing hip flexion based exercises which grow your quads",2024-07-17T07:43:59.000Z,0,eriicryan,en,US
https://www.instagram.com/p/C9TgmWayIWL/,18450839887009307,"Keep training barefoot girl, these Insta haters are ignorant and simply disgusting themselves. Pity they're incable of washing themselves 😂",2024-07-17T06:43:29.000Z,1,clschultz26,en,US
https://www.instagram.com/p/C9TgmWayIWL/,18021340574105205,First time I've seen someone get so much flack for nothing 😂 @squat_university care to explain why training barefoot is bad? 😂,2024-07-17T06:42:38.000Z,0,clschultz26,en,US
https://www.instagram.com/p/C9TgmWayIWL/,18050434810750812,Whats that ur home or garden? Put shoes on and respect others,2024-07-17T06:11:24.000Z,0,mareks_dunkurs,en,US
https://www.instagram.com/p/C9TgmWayIWL/,17876869050052326,Nasty barefoot in gym,2024-07-17T06:03:11.000Z,0,adamsbackagain,en,US
https://www.instagram.com/p/C9TgmWayIWL/,18362481541099865,You’re the worst person to have to share a gym with,2024-07-17T05:40:07.000Z,1,_orz0_,en,US
https://www.instagram.com/p/DSobwtFDgpn/,17937099066129825,Yes please,2026-01-02T01:45:55.000Z,0,calialydale,en,US
https://www.instagram.com/p/DSobwtFDgpn/,17934890163134809,Link please!,2026-01-02T00:32:51.000Z,0,dorfmanra,en,US
https://www.instagram.com/p/DSobwtFDgpn/,18161122804401476,Love them all,2026-01-02T00:15:34.000Z,0,melanie.kay33,en,US
https://www.instagram.com/p/DSobwtFDgpn/,18051468557690648,Link please,2026-01-02T00:01:02.000Z,0,val_kell,en,US
https://www.instagram.com/p/DSobwtFDgpn/,18090163243976206,The boots,2026-01-01T22:45:23.000Z,0,rockmountaingirl,en,US
https://www.instagram.com/p/C9TgmWayIWL/,18011347133606195,Dirty feet on the equipment that everyone else uses 🤮🤮🤮🤮,2024-07-17T05:29:21.000Z,0,alpal_001,en,US
https://www.instagram.com/p/C9TgmWayIWL/,18100896619423512,"Isn't the floor dirty? Dead skin cells, body sweat, dirty from outside that's brought inside by other people's shoes... so many germs 😮",2024-07-17T05:06:51.000Z,0,s.v.j.r_,en,US
https://www.instagram.com/p/C9TgmWayIWL/,18076674910506093,Feet for more views🤦‍♂️,2024-07-17T03:37:06.000Z,17,grivera1992,en,US
https://www.instagram.com/p/C9TgmWayIWL/,17930474102906418,Taking your socks and shoes off in a public gym is absolutely disgusting and wild.,2024-07-17T03:35:11.000Z,0,kingruso,en,US
https://www.instagram.com/p/C9TgmWayIWL/,18057250000653854,There is no need to slap your glutes and patch your glutes like that there’s absolutely no reason no need,2024-07-17T02:52:22.000Z,0,kkickassss,en,US
https://www.instagram.com/p/C9TgmWayIWL/,17864787504172009,What if you drop or someone accidentally drop somethin on the pretty foot?,2024-07-17T02:20:48.000Z,0,paul_el_unico,en,US
https://www.instagram.com/p/C9TgmWayIWL/,18035481434067032,Those who are grossed by feet think everyone's feet is like theirs. If your or your partner feet are gross doesn't mean others poeple feet are gross.  She has cleaner feet than your mouths.  KArens,2024-07-17T02:20:15.000Z,17,_zen.mind,en,US
https://www.instagram.com/p/C9TgmWayIWL/,17843329443269334,Just workout pls … we dont need the filming,2024-07-17T01:27:31.000Z,0,andy_3975,en,US
https://www.instagram.com/p/C9TgmWayIWL/,18004970366345496,Such pretty feet,2024-07-16T22:42:03.000Z,1,cronjegio,en,US
https://www.instagram.com/p/C9TgmWayIWL/,18029881969960927,Nice feet,2024-07-16T21:31:26.000Z,1,vienna_colts,en,US
https://www.instagram.com/p/DSobwtFDgpn/,17952730335064377,Love all of them,2026-01-01T21:36:00.000Z,0,palfreyeileen,en,US
https://www.instagram.com/p/DSobwtFDgpn/,18189593323340369,Link please,2026-01-01T20:36:38.000Z,0,hairbysandrakh,en,US
https://www.instagram.com/p/DSobwtFDgpn/,17858598972578339,Love 💕 links please,2026-01-01T06:18:18.000Z,0,mel.buendia,en,US
https://www.instagram.com/p/C9TgmWayIWL/,18012030338283367,Just wait until you contract athletes foot,2024-07-16T20:53:23.000Z,0,theauthorofallthings,en,US
https://www.instagram.com/p/C9TgmWayIWL/,17971950272741822,Hope this gym owner knows this is a lawsuit waiting to happen .. better have some rules,2024-07-16T20:47:36.000Z,0,filllet2u,en,US
https://www.instagram.com/p/C9TgmWayIWL/,18026544503225271,Socks off and no ass. she was just trying to show off the dogs 🦶💅,2024-07-16T20:44:44.000Z,0,doughboi712,en,US
https://www.instagram.com/p/C9TgmWayIWL/,17990903960659442,Yea put your shoes on nasty thing,2024-07-16T20:21:49.000Z,0,drewthe_great,en,US
https://www.instagram.com/p/C9TgmWayIWL/,18024845321204863,No shoes and socks at the gym is diabolical,2024-07-16T20:15:52.000Z,0,ocalisthegreat,en,US
https://www.instagram.com/p/C9TgmWayIWL/,18020737718364964,Bare foot 🦶🤢🤢🤢🤢🤢🤢🤢🤢🤮,2024-07-16T19:46:13.000Z,0,_jet_set_life_,en,US
https://www.instagram.com/p/C9TgmWayIWL/,18037071958990863,are you looking at my feet? how dare you,2024-07-16T19:37:14.000Z,0,rundyl,en,US
https://www.instagram.com/p/C9TgmWayIWL/,18023190107257785,Sheeeeesh total unit…so much hate on those finely appointed piglets. 🔥,2024-07-16T19:28:16.000Z,0,comsenseisnotcommon,en,US
https://www.instagram.com/p/C9TgmWayIWL/,18094304878443761,Put your fucking shoes and socks on weirdo. This ain’t your home gym,2024-07-16T19:01:09.000Z,0,matt.vas01,en,US
https://www.instagram.com/p/C9TgmWayIWL/,18019294586129472,Doing this and not seeing a problem is a different level of entitlement 💀.,2024-07-16T18:05:22.000Z,0,____gusta__,en,US
https://www.instagram.com/p/DSobwtFDgpn/,18089532769813536,Fleece sweater ! 🔥,2025-12-31T15:52:11.000Z,0,krissyy_1166,en,US
https://www.instagram.com/p/DSobwtFDgpn/,17905538661166117,Ash,2025-12-31T15:00:11.000Z,0,rebelbeyondsobriety,en,US
https://www.instagram.com/p/DSobwtFDgpn/,18105381475783302,Bag and links please,2025-12-31T01:37:44.000Z,0,smacdonald_76,en,US
https://www.instagram.com/p/C9TgmWayIWL/,18233163868276384,At least 3 🚩🚩🚩,2024-07-16T16:36:57.000Z,0,banshe63,en,US
https://www.instagram.com/p/C9TgmWayIWL/,18173719516305800,Feet for fan im sure there is 95% liked by men,2024-07-16T16:32:43.000Z,0,sachajauregui,en,US
https://www.instagram.com/p/C9TgmWayIWL/,17871167124117087,Yes stupid and unsanitary,2024-07-16T16:30:06.000Z,0,ec140,en,US
https://www.instagram.com/p/C9TgmWayIWL/,18261973303219786,"Unpopular opinion, but if you’ve ever wrestled or competed at BJJ,…you don’t really give a shit about people being barefoot. Some antibacterial body wash and a loofah can keep you pretty safe.",2024-07-16T15:55:47.000Z,7,bmoss_64,en,US
https://www.instagram.com/p/C9TgmWayIWL/,18241114417259468,Jesus look at the men gawking in the background disgusting you should of reported them 🙄,2024-07-16T15:48:45.000Z,0,novig_divad,en,US
https://www.instagram.com/p/C9TgmWayIWL/,17980834181565447,Wtf firstly people started to workout without shoes right now they don’t even wear socks idiots,2024-07-16T15:30:43.000Z,0,dgknkartal,en,US
https://www.instagram.com/p/C9TgmWayIWL/,18039714607805229,Best routine to get toe fungus.,2024-07-16T15:29:03.000Z,16,zachgray,en,US
https://www.instagram.com/p/C9TgmWayIWL/,18095457928447329,Barefoot everywhere but the house. 👏👏,2024-07-16T14:42:34.000Z,0,gsp_bobby,en,US
https://www.instagram.com/p/C9TgmWayIWL/,18010677539291453,"all the podiatrist and microbial experts in the comments 🤣 take your shoes off, live a little, everything will be fine",2024-07-16T12:08:22.000Z,0,discalceation,en,US
https://www.instagram.com/p/C9TgmWayIWL/,18420928846064478,You look incredible! ❤️,2024-07-16T11:59:57.000Z,1,taytaynicolexo,en,US
https://www.instagram.com/p/C9TgmWayIWL/,18052526890703758,Public gym with no shoes on . I’m done 🤮🤮🤮,2024-07-16T11:41:07.000Z,0,bloomfam,en,US
https://www.instagram.com/p/C9TgmWayIWL/,18007608392563210,For free?,2024-07-16T11:29:37.000Z,0,tohaheavyindustriez,en,US
https://www.instagram.com/p/C9TgmWayIWL/,17978334653710311,& im not supposed to stare at yo toes ? Yeah ight 😂,2024-07-16T10:52:23.000Z,0,donovan_422_,en,US
https://www.instagram.com/p/C9TgmWayIWL/,18043754074737400,Stop filming in public spaces and respect privacy,2024-07-16T10:37:17.000Z,0,mikkiehbvex,en,US
https://www.instagram.com/p/C9TgmWayIWL/,18011009426595515,Put some socks on and stop filming you are rank,2024-07-16T10:15:08.000Z,0,dylancombe180,en,US
https://www.instagram.com/p/C9TgmWayIWL/,17950874150810915,Barefoot? 🤢,2024-07-16T09:54:13.000Z,0,will3ski,en,US
https://www.instagram.com/p/C9TgmWayIWL/,18073082542471627,Great form 👏🏼. but girlie…put on shoes! You’re going to get ringworm or athletes foot 🤮,2024-07-16T09:52:21.000Z,0,emma.koven,en,US
https://www.instagram.com/p/C9TgmWayIWL/,18013847477237386,Eating chips and immediately went to comments 😁,2024-07-16T09:43:19.000Z,0,nornor_io,en,US
https://www.instagram.com/p/C9TgmWayIWL/,18232115242274802,Put your shoes on! Nasty 🤮,2024-07-16T09:21:08.000Z,0,donnamae76,en,US
https://www.instagram.com/p/C9TgmWayIWL/,18011418887281648,How do you know this funkie jam?,2024-07-16T09:18:23.000Z,0,thegoldencudgel,en,US
https://www.instagram.com/p/DSobwtFDgpn/,17991372731745674,Britt,2025-12-31T00:14:30.000Z,0,britt_saroka,en,US
https://www.instagram.com/p/DSobwtFDgpn/,18140902105412646,@mary_the_marketer,2025-12-30T22:57:37.000Z,0,mary_the_marketer,en,US
https://www.instagram.com/p/DSobwtFDgpn/,18078211022248831,Yes please,2025-12-30T19:00:01.000Z,0,bpletschette5,en,US
https://www.instagram.com/p/DSobwtFDgpn/,18109663975651673,Shoes please,2025-12-30T18:58:16.000Z,0,katiewills18,en,US
https://www.instagram.com/p/DSobwtFDgpn/,18110332393615952,Please,2025-12-30T18:56:14.000Z,0,rjjige,en,US
https://www.instagram.com/p/DSobwtFDgpn/,17924439726056255,i'm just as skinny but without the thigh gap aahhh😭💔 your legs look so pretty girl! 😂❤️❤️,2025-12-30T18:09:30.000Z,0,icedteacafe,en,US
https://www.instagram.com/p/C9TgmWayIWL/,18091548250454854,Can I come to your gym and record you doing a workout,2024-07-16T09:10:00.000Z,0,lxs__0_,en,US
https://www.instagram.com/p/C9TgmWayIWL/,17887171064999985,I feel your pain!,2024-07-16T09:05:20.000Z,0,hoppy.1213,en,US
https://www.instagram.com/p/C9TgmWayIWL/,18243357715251496,"I wish we could go back to separate gyms. In the 80’s I was a member of a gym that had 2 sides, 1 for men & 1 for women. I will never go to another gym unless it’s a women’s only. I’m intimidated by fit women but when you add meatheads to the mix it’s too much!",2024-07-16T08:47:29.000Z,0,southernlivn,en,US
https://www.instagram.com/p/C9TgmWayIWL/,18010115264311943,Disgusting.. please wear socks,2024-07-16T08:42:57.000Z,0,kutayozi,en,US
https://www.instagram.com/p/C9TgmWayIWL/,18002976128382966,Put your shoes on and stop filming!! Totally inconsiderate!!!,2024-07-16T08:12:41.000Z,0,cordelia_cummings,en,US
https://www.instagram.com/p/C9TgmWayIWL/,18271043371174932,Gym location?,2024-07-16T07:36:49.000Z,0,nikitathegoat,en,US
https://www.instagram.com/p/C9TgmWayIWL/,18035293592044869,Stop filming people at gym,2024-07-16T07:27:43.000Z,0,aftermath29,en,US
