post_url,comment_id,text,timestamp,likes,username,lang,region
https://www.instagram.com/p/C9TgmWayIWL/,17908776824901664,I’m just trying to get over the shock of you not calling out those 2 older gentleman who briefly glanced in your direction for 1.25 seconds . 😂,2024-07-21T11:14:27.000Z,0,mattianfern,en,US
https://www.instagram.com/p/C9TgmWayIWL/,18026048168332784,Soon feet only fans ?,2024-07-21T10:53:19.000Z,0,feetworld3942,en,US
https://www.instagram.com/p/C9TgmWayIWL/,18030187856162217,"Gross, put your shoes on 😂",2024-07-20T23:03:41.000Z,0,colombianbean,en,US
https://www.instagram.com/p/C9TgmWayIWL/,18019574858130524,Who let the dogs out?🤦‍♂️,2024-07-20T19:32:36.000Z,0,deniss.vis,en,US
https://www.instagram.com/p/C9TgmWayIWL/,18133572109343784,Everyone thinks they are Arnold …stop with the bare feet 🦶,2024-07-20T18:39:40.000Z,0,nico_toscani88,en,US
https://www.instagram.com/p/C9TgmWayIWL/,18451086481010586,Imagine being this vain.,2024-07-20T12:37:50.000Z,0,dougpharr1960,en,US
https://www.instagram.com/p/DTXzbP0DUOu/,18102907072752864,Congratulations,2026-01-13T02:48:46.000Z,0,jimila.fernandez,en,US
https://www.instagram.com/p/DTXzbP0DUOu/,18175552105336360,A little on hyd. Fluid I see,2026-01-12T23:43:50.000Z,0,dezert_fox501,en,US
https://www.instagram.com/p/DTXzbP0DUOu/,17887099434423223,"Congrats Sgt. I was just waiting for him to be dismissed and do an about face and take the first step right off the back of the lift gate, I’m disappointed. 
🫡🇺🇸",2026-01-12T23:15:05.000Z,0,randef,en,US
https://www.instagram.com/p/DTXzbP0DUOu/,18085127390514375,W. T. F. IS THIS MICKEY MOUSE BULLSHIT!,2026-01-12T23:10:48.000Z,0,old_school_0927,en,US
https://www.instagram.com/p/DTXzbP0DUOu/,18064186820243589,The pond reenlistment is still the best one,2026-01-12T23:05:46.000Z,0,leonaardokek,en,US
https://www.instagram.com/p/DTXzbP0DUOu/,18073513403458487,"Honestly, I seen better, but the lift gate was a nice touch",2026-01-12T22:50:19.000Z,0,gil.garcia.873173,en,US
https://www.instagram.com/p/DTXzbP0DUOu/,18032204879569757,Thank you for your brave and courageous service Marine,2026-01-12T22:06:00.000Z,0,neff.jerry,en,US
https://www.instagram.com/p/DSobwtFDgpn/,18078189161039845,Links please,2026-01-25T22:21:07.000Z,0,kstrems,en,US
https://www.instagram.com/p/DSobwtFDgpn/,18554649736009320,@snipestwins which gray quarter zip is that?? 😍,2026-01-25T18:52:02.000Z,0,definitelynotkatyperry,en,US
https://www.instagram.com/p/DSobwtFDgpn/,17873972163484844,Giyphe,2026-01-25T18:50:01.000Z,0,giyphe,en,US
https://www.instagram.com/p/DSobwtFDgpn/,18100416796863061,Link please !!,2026-01-25T03:41:56.000Z,0,pauvaldes,en,US
https://www.instagram.com/p/DSobwtFDgpn/,18108931228674963,leggings please? xx,2026-01-24T20:33:31.000Z,0,s23lna,en,US
https://www.instagram.com/p/DSobwtFDgpn/,18086250977472122,Love the pants and boots,2026-01-24T14:07:15.000Z,0,kaseywood2,en,US
https://www.instagram.com/p/DTXzbP0DUOu/,18142177270465608,"Hell, yes congratulations bro. You got this bro.",2026-01-12T22:03:37.000Z,0,ddingron,en,US
https://www.instagram.com/p/DTXzbP0DUOu/,17995013351910541,Got his ass,2026-01-12T21:49:33.000Z,0,benjaminwushubui,en,US
https://www.instagram.com/p/DTXzbP0DUOu/,18072753992611800,Should’ve saluted the whole way up,2026-01-12T21:49:09.000Z,0,wilk_47,en,US
https://www.instagram.com/p/DTXzbP0DUOu/,18103688791704772,Maybe an abandoned house next time. Sheesh,2026-01-12T21:42:56.000Z,0,gconsidder,en,US
https://www.instagram.com/p/DTXzbP0DUOu/,18061864793294772,Definitely Marine Corps. Tommy lift won’t go all the way up.,2026-01-12T20:47:41.000Z,0,joep2412,en,US
https://www.instagram.com/p/DTXzbP0DUOu/,18380996632155548,Who else was waiting for a growling “Marine Corps .. and a backflip,2026-01-12T20:28:48.000Z,1,notmine911,en,US
https://www.instagram.com/p/DTXzbP0DUOu/,18122972596547363,"Who’s the captain, looks familiar?",2026-01-12T20:22:30.000Z,0,sir_guk,en,US
https://www.instagram.com/p/DTXzbP0DUOu/,18089335877090297,"Being in aviation, why not reenlist on then tailgate of an aircraft rather than a truck🧐",2026-01-12T20:16:15.000Z,0,tjnzski,en,US
https://www.instagram.com/p/DSobwtFDgpn/,18056432627352312,Amy 😍,2026-01-23T22:45:21.000Z,0,outdoorsyjeepgirl,en,US
https://www.instagram.com/p/DSobwtFDgpn/,18305526649261135,🔗please🔥,2026-01-23T06:17:39.000Z,0,clarissam29,en,US
https://www.instagram.com/p/DSobwtFDgpn/,18080948962976507,Link please,2026-01-23T03:01:18.000Z,0,galgamay,en,US
https://www.instagram.com/p/DSobwtFDgpn/,18073657976456697,Send please,2026-01-22T16:19:36.000Z,0,fiona.guy,en,US
https://www.instagram.com/p/DSobwtFDgpn/,18114370147537675,link please,2026-01-22T03:31:16.000Z,0,tanyamarielivingmylife,en,US
https://www.instagram.com/p/DSobwtFDgpn/,18004344407692141,The gap is mesmerizing,2026-01-20T22:56:45.000Z,0,rick.polacek,en,US
https://www.instagram.com/p/DSobwtFDgpn/,18192146998339892,the shoes are my everything,2026-01-19T04:13:34.000Z,0,_mercedesmosley,en,US
https://www.instagram.com/p/DSobwtFDgpn/,18109531531635319,Link please 🔗,2026-01-18T11:22:30.000Z,0,exclusivephotobook,en,US
https://www.instagram.com/p/DTXzbP0DUOu/,18325742281223236,What gave you the idea?😃,2026-01-12T19:44:56.000Z,0,artbrown782,en,US
https://www.instagram.com/p/DTXzbP0DUOu/,18123690160558881,Motorpool leads the way,2026-01-12T19:42:01.000Z,1,frankreyes1911,en,US
https://www.instagram.com/p/DTXzbP0DUOu/,18109117369656760,cherry point??,2026-01-12T19:12:16.000Z,0,e93life,en,US
https://www.instagram.com/p/DTXzbP0DUOu/,18007298042677557,Let's the ORM Matrix on this one. 😎,2026-01-12T19:07:51.000Z,1,skitzoidbrain,en,US
https://www.instagram.com/p/DTXzbP0DUOu/,17910714579292729,"Meanwhile the last reenlistment ""ceremony"" I saw before I got out was done at 10 in the 1SG's office on a Friday so we all got released at lunch.",2026-01-12T19:06:31.000Z,0,mattwolfen,en,US
https://www.instagram.com/p/DTXzbP0DUOu/,18062114072282950,my lpo did hers at disney land,2026-01-12T19:04:20.000Z,0,dja111pumma45,en,US
https://www.instagram.com/p/DTXzbP0DUOu/,18156560062421904,That’s great but there’s so many things wrong with this video I don’t even know where to start,2026-01-12T18:46:26.000Z,0,_0cms3_,en,US
https://www.instagram.com/p/DTXzbP0DUOu/,17902123386349552,Better than working for a living.,2026-01-12T18:45:00.000Z,0,echo7oscar,en,US
https://www.instagram.com/p/DTXzbP0DUOu/,18034669043684990,Top 10 lock ins of all time,2026-01-12T17:34:26.000Z,0,brisatrbl,en,US
https://www.instagram.com/p/DTXzbP0DUOu/,17933048160168941,should've backflipped off the TommyLift,2026-01-12T17:06:46.000Z,0,phildipaolo,en,US
https://www.instagram.com/p/DSobwtFDgpn/,18068518592629974,Need it all,2026-01-17T15:54:55.000Z,0,bananasmom,en,US
https://www.instagram.com/p/DSobwtFDgpn/,18063235781559311,Cuteness as always!,2026-01-17T13:47:00.000Z,0,jesser1727,en,US
https://www.instagram.com/p/DSobwtFDgpn/,17940636930106262,What are the shoes,2026-01-15T02:03:26.000Z,0,officialsunsetglow,en,US
https://www.instagram.com/p/C9TgmWayIWL/,17894742882027071,Having your shoes and socks off makes zero difference,2024-07-20T12:35:26.000Z,0,mat_tuff,en,US
https://www.instagram.com/p/C9TgmWayIWL/,18020342624374889,Put your socks on you scruff,2024-07-20T12:33:18.000Z,0,james.jenkins93,en,US
https://www.instagram.com/p/C9TgmWayIWL/,17858740263207157,"It looks like she took the shoes off just for this or other specific exercises, I doubt she’s gonna catch anything with minimal exposure … to the ppl missing the point, I think the critics aren’t worried about her spreading germs, they’re grossed out about her potentially catching germs from the dirty gym floor … but everyone can relax 😂 😂… at least she doesn’t have bunions lol",2024-07-20T11:55:55.000Z,0,discussdough,en,US
https://www.instagram.com/p/C9TgmWayIWL/,17973704738741950,Wtf is with peeps not wearing shoes in the gym these days. What tards,2024-07-20T11:33:31.000Z,3,snobby_pippy,en,US
https://www.instagram.com/p/C9TgmWayIWL/,17858682003206196,Mind your back,2024-07-20T11:25:24.000Z,0,el_charlosdelavida,en,US
https://www.instagram.com/p/C9TgmWayIWL/,17854804590228758,Someone with zero glutes giving a tutorial on how they target their non existent glutes ….smh,2024-07-20T10:20:41.000Z,4,cfalse76,en,US
https://www.instagram.com/p/C9TgmWayIWL/,18029754125510487,Why do you need to use a lifting rack to do this exercise ….looks like crowded gym and someone else probably coulda put that rack to better use …,2024-07-20T10:18:40.000Z,0,cfalse76,en,US
https://www.instagram.com/p/C9TgmWayIWL/,18057568813649990,Everyone is soooooo over this. . Just workout and leave.  Then maybe do some bikini pics?  There is something new.,2024-07-20T10:00:59.000Z,0,jrw_rocknroller,en,US
https://www.instagram.com/p/C9TgmWayIWL/,18013826540452823,How’s the 401 ?,2024-07-20T09:29:40.000Z,0,tampapalms_injector,en,US
https://www.instagram.com/p/C9TgmWayIWL/,17947695620717911,I hate when ppl go barefoot in the gym. Them feet stank!!,2024-07-20T08:27:30.000Z,0,audioacne,en,US
https://www.instagram.com/p/C9TgmWayIWL/,18082215712496367,What’s with filming every person in the gym? 🤦‍♂️ pathetic,2024-07-20T07:53:12.000Z,0,dupree_went_to_the_movies,en,US
https://www.instagram.com/p/C9TgmWayIWL/,17950759514812948,Her feet aren’t a danger to other people. Other people’s shoes are covered in urine from walking through the bathroom. The dirt is her issue to deal with.,2024-07-20T06:29:18.000Z,0,trainlegswithme,en,US
https://www.instagram.com/p/C9TgmWayIWL/,18305387665082934,This is how you get foot fungus,2024-07-20T05:48:52.000Z,0,heheheheather,en,US
https://www.instagram.com/p/DTXzbP0DUOu/,18163702900362620,Yessirr congrats brother!,2026-01-12T16:47:09.000Z,0,r.vaughnn,en,US
https://www.instagram.com/p/DTXzbP0DUOu/,18068779793390844,"Some have never had this on film, even if nobody gets it.  Every rate is golden.  Oorah!",2026-01-12T16:00:56.000Z,1,arbiegroninger,en,US
https://www.instagram.com/p/DTXzbP0DUOu/,17966067821862178,R2d2 where are you? He's a truck lift in the usaf,2026-01-12T15:33:51.000Z,0,jhitower,en,US
https://www.instagram.com/p/DTXzbP0DUOu/,17977470518966602,Lock in of all time,2026-01-12T15:06:41.000Z,0,s197gg,en,US
https://www.instagram.com/p/DTXzbP0DUOu/,18052619252418460,Did he just round off that pivot ?,2026-01-12T13:50:23.000Z,5,bklyndon9,en,US
https://www.instagram.com/p/DTXzbP0DUOu/,17859798594581048,Is this NAS Fort Worth?,2026-01-12T11:54:11.000Z,0,guzist.214,en,US
https://www.instagram.com/p/DTXzbP0DUOu/,17926005165195372,Am I the only one who wanted him to about face on accident and fall off?,2026-01-12T05:17:53.000Z,1,lancehaag,en,US
https://www.instagram.com/p/DTXzbP0DUOu/,17955109299059718,OUTSTANDING !. The World's Finest US Marine Aviation. Semper Fi,2026-01-12T02:50:08.000Z,11,steveneromero,en,US
https://www.instagram.com/p/DTXzbP0DUOu/,18084005807172833,🤣🤣 congrats brother!! Semper Fi!🍻🍻,2026-01-12T02:13:15.000Z,0,dangelo.alonso27,en,US
https://www.instagram.com/p/C9TgmWayIWL/,18121190884372834,Cute feet,2024-07-20T04:29:05.000Z,0,splint_art,en,US
https://www.instagram.com/p/C9TgmWayIWL/,17891468060981889,Please wear shoes 👠,2024-07-20T02:52:32.000Z,0,emrah_ceo,en,US
https://www.instagram.com/p/C9TgmWayIWL/,18034781303318176,I KNOW she has athletes foot. Good luck lady.,2024-07-20T02:14:57.000Z,0,zerothe_dog,en,US
https://www.instagram.com/p/C9TgmWayIWL/,18040800775941176,Barefoot and recording yourself in the gym is craaaaaazzzzyyyyyy!!😩,2024-07-20T01:29:16.000Z,0,itsjoeyhollywood,en,US
https://www.instagram.com/p/C9TgmWayIWL/,17856575190215269,What these videos are is a chance to show your ass in tight pants.,2024-07-20T01:20:32.000Z,0,marklikeswinter,en,US
https://www.instagram.com/p/C9TgmWayIWL/,18104642845410687,wow not one supportive comment in sight,2024-07-20T01:06:32.000Z,0,dezzkasan,en,US
https://www.instagram.com/p/C9TgmWayIWL/,18046626901853368,"Barefoot?!!! Why??? You have to have hygiene, in that gym there are more people besides you 😷😷😷😷🤢",2024-07-19T23:42:17.000Z,0,the_buck_stops_here99,en,US
https://www.instagram.com/p/C9TgmWayIWL/,18030214880281532,"No shoes, no socks….. gross!!!🤮",2024-07-19T23:40:21.000Z,0,jam33113,en,US
https://www.instagram.com/p/C9TgmWayIWL/,18090530581413832,"Looking at the flatness of ur bum, looks like u just started these exercises",2024-07-19T22:54:33.000Z,0,ivoke_design,en,US
https://www.instagram.com/p/C9TgmWayIWL/,17896116072023737,Raw dogging with no socks is crazy 😂,2024-07-19T22:53:33.000Z,0,tully.tomlinson,en,US
https://www.instagram.com/p/C9TgmWayIWL/,17927762939796255,Crusty ass feet on the equipment and shit hell nah,2024-07-19T22:42:28.000Z,0,roxbyphillip,en,US
https://www.instagram.com/p/DSobwtFDgpn/,18436496053108534,The bag 😍 and everything is fab!!But the bag 😍😍🔥,2026-01-14T12:16:19.000Z,0,eviebergstrom,en,US
https://www.instagram.com/p/DSobwtFDgpn/,18303091015283089,Boots link please,2026-01-14T05:12:59.000Z,0,eddiesmamat,en,US
https://www.instagram.com/p/DSobwtFDgpn/,17922786435074306,MaryAllison!!,2026-01-13T23:48:21.000Z,0,thatboatbabe,en,US
https://www.instagram.com/p/DSobwtFDgpn/,18124729024538235,Love it all please,2026-01-13T19:28:18.000Z,0,lynn.bax,en,US
https://www.instagram.com/p/DSobwtFDgpn/,17911232316295195,Winter lulu hauls hit different! The cozy athleisure vibes are everything,2026-01-13T16:48:21.000Z,0,cozybutboldkaren,en,US
https://www.instagram.com/p/DTXzbP0DUOu/,18068679323398143,good shit brother,2026-01-11T18:11:16.000Z,1,aydencescamo,en,US
https://www.instagram.com/p/DTXzbP0DUOu/,18073352726373893,that boy CAKED up,2026-01-11T18:11:06.000Z,13,aydencescamo,en,US
https://www.instagram.com/p/DTXzbP0DUOu/,17863609488557492,Hell yeah 🔥,2026-01-11T15:03:10.000Z,2,josebarbosa88,en,US
https://www.instagram.com/p/DTXzbP0DUOu/,18083779202181753,Hell yeah congrats brotha,2026-01-11T13:53:17.000Z,46,_komasi_,en,US
https://www.instagram.com/p/DSobwtFDgpn/,18158240491417659,Jeas,2026-01-13T13:30:50.000Z,0,firstsightfrederick,en,US
https://www.instagram.com/p/DSobwtFDgpn/,18067451819178480,🔗 pretty please,2026-01-13T13:29:48.000Z,0,firstsightfrederick,en,US
https://www.instagram.com/p/DSobwtFDgpn/,18371277226089677,Love it 😍,2026-01-13T02:39:42.000Z,0,monseom91,en,US
https://www.instagram.com/p/C9TgmWayIWL/,18036437401862216,For free????,2024-07-19T21:07:40.000Z,0,jon111_pro,en,US
https://www.instagram.com/p/C9TgmWayIWL/,17842464873274602,Filming needs to be banned in all gyms.,2024-07-19T21:06:00.000Z,0,rusty__ronin,en,US
https://www.instagram.com/p/C9TgmWayIWL/,18071933485536528,Pay attention to your knee cap and cruciate ligaments,2024-07-19T19:22:49.000Z,0,erhanyardibi,en,US
https://www.instagram.com/p/C9TgmWayIWL/,18018956948162004,Why bare feet?,2024-07-19T18:52:50.000Z,0,mic.mierzwa2018,en,US
https://www.instagram.com/p/C9TgmWayIWL/,17885617434072661,Are the glutes in the room with us right now?,2024-07-19T18:21:54.000Z,0,itbeanthonyb,en,US
https://www.instagram.com/p/C9TgmWayIWL/,17908784156900964,That’s not your gym so wear proper outfit including socks. Disgusting,2024-07-19T18:13:39.000Z,0,cerise_5535,en,US
https://www.instagram.com/p/C9TgmWayIWL/,18103181572414191,Shoes must be worn! Wtf???,2024-07-19T17:30:53.000Z,0,edvinmester,en,US
https://www.instagram.com/p/C9TgmWayIWL/,18096955153429737,Shoes on. So selfish,2024-07-19T17:23:49.000Z,0,p_simo8,en,US
https://www.instagram.com/p/DSobwtFDgpn/,18035378114769256,Please send me links to everything !!,2026-01-11T19:18:25.000Z,0,josielynnxo,en,US
https://www.instagram.com/p/DSobwtFDgpn/,18089245685008646,Love. Yes please,2026-01-11T18:34:10.000Z,0,corey_sobota,en,US
https://www.instagram.com/p/DSobwtFDgpn/,18050889152461773,Link please,2026-01-11T14:36:47.000Z,0,einatspoont,en,US
https://www.instagram.com/p/DSobwtFDgpn/,18092929594945708,🔗 please!,2026-01-11T14:22:01.000Z,0,marixrappley,en,US
https://www.instagram.com/p/DSobwtFDgpn/,18077207288203853,Link please!,2026-01-11T05:14:52.000Z,0,darcyt_01,en,US
https://www.instagram.com/p/DSobwtFDgpn/,18062339039299815,Link please 🙏🏻,2026-01-11T02:49:26.000Z,0,ashleyelizabeth.xo,en,US
https://www.instagram.com/p/DSobwtFDgpn/,17973337100991557,Omggg the spots are so cute,2026-01-11T02:27:06.000Z,0,tiainchina,en,US
https://www.instagram.com/p/DSobwtFDgpn/,18170866330377286,Link please,2026-01-10T16:41:17.000Z,0,mariedelwest_,en,US
https://www.instagram.com/p/C9TgmWayIWL/,18447454873035715,i can feel the burn just from watching,2024-07-19T16:58:03.000Z,3,abbyrosedemartino,en,US
https://www.instagram.com/p/C9TgmWayIWL/,18004759058630129,Gym membership should be canceled for this straight as plank girl . She obviously dont know how to use public gyms nor she knows technique of this excircise. Pathetic,2024-07-19T16:46:40.000Z,0,maxim_px,en,US
https://www.instagram.com/p/C9TgmWayIWL/,18018328262159424,"One dumbbell on the toes will end the no-shoes nonsense forever, I promise.",2024-07-19T16:24:59.000Z,0,jfish56,en,US
https://www.instagram.com/p/C9TgmWayIWL/,17917088843954169,Put socks on…,2024-07-19T15:57:09.000Z,0,marcusmcallister__,en,US
https://www.instagram.com/p/C9TgmWayIWL/,18031820225479325,Women still posting this shit like it’s relevant or unique is willld,2024-07-19T15:49:44.000Z,0,coltslense,en,US
https://www.instagram.com/p/C9TgmWayIWL/,18270560806214690,Feet is pretty but u wildn barefoot in the gym,2024-07-19T15:40:01.000Z,0,amoore.81,en,US
https://www.instagram.com/p/C9TgmWayIWL/,18052173136684169,When are you posting the exercises that target your glutes?,2024-07-19T15:21:22.000Z,0,_ssor_dwan,en,US
https://www.instagram.com/p/C9TgmWayIWL/,17947829918719229,I don’t get this new trend of taking off your socks and shoes in the gym???,2024-07-19T14:46:12.000Z,0,battagliol,en,US
https://www.instagram.com/p/C9TgmWayIWL/,17924748317924138,Disrespectful to film other people at gym,2024-07-19T14:34:49.000Z,0,zeeco590,en,US
https://www.instagram.com/p/C9TgmWayIWL/,18010945361306666,"Do you find that leaning forward slightly increases glute and hamstring activation? As an ultra runner, this does for me and important. Oh and ignore those nonsense comments about why you are barefoot. Many of us are happy that you are.",2024-07-19T14:19:19.000Z,0,neilax.ultra,en,US
https://www.instagram.com/p/C9TgmWayIWL/,17931743594791123,What a pitty,2024-07-19T14:06:40.000Z,0,politisgiorg,en,US
https://www.instagram.com/p/C9TgmWayIWL/,18058156267650887,WOW...Here's some attention... we know you want it.,2024-07-19T13:44:21.000Z,0,critterbeans1,en,US
https://www.instagram.com/p/C9TgmWayIWL/,17904416432917508,I see nail fungus in her future,2024-07-19T13:24:20.000Z,0,anthanity_v2,en,US
https://www.instagram.com/p/DSobwtFDgpn/,17858740809528096,Link please?!,2026-01-09T21:58:43.000Z,0,hausofharvey23,en,US
https://www.instagram.com/p/C9TgmWayIWL/,17882783997084700,Where is the set from?,2024-07-19T13:22:56.000Z,0,shafaq.hq,en,US
https://www.instagram.com/p/C9TgmWayIWL/,17920231994842363,Nobody cares about your injuries and stop filming in gyms.,2024-07-19T12:54:43.000Z,0,clsmooth1220,en,US
https://www.instagram.com/p/C9TgmWayIWL/,18012992471250964,No shoes or socks?  Wtf,2024-07-19T11:18:10.000Z,0,tonybrownphoto,en,US
https://www.instagram.com/p/C9TgmWayIWL/,18055881403712023,Everyone hates this and you.,2024-07-19T10:14:58.000Z,0,donin60seconds_,en,US
https://www.instagram.com/p/C9TgmWayIWL/,18029175356160233,"How are all those guys able to work out with t-shirts and shorts? I thought women wore less clothes to the gym for ""mobility"" purposes but those guys seem to be doing fine if not better than you..",2024-07-19T09:32:02.000Z,0,kevufo,en,US
https://www.instagram.com/p/C9TgmWayIWL/,17852141805201953,Put shoes on,2024-07-19T09:21:04.000Z,0,jacko_w14,en,US
https://www.instagram.com/p/C9TgmWayIWL/,18096644164440675,Bro is giving advice to have glutes 😂,2024-07-19T09:09:27.000Z,0,amamousofienne,en,US
https://www.instagram.com/p/DSobwtFDgpn/,18329602423244924,Where are the waterproof boots from please? Does anyone know? I’m 🇬🇧 so the kinks don’t normally work? Xx,2026-01-09T15:06:39.000Z,0,annabelburrill,en,US
https://www.instagram.com/p/DSobwtFDgpn/,18553148026061141,Please send me the 🔗😍,2026-01-09T05:56:03.000Z,0,kati_bitte.ohne.h,en,US
https://www.instagram.com/p/DSobwtFDgpn/,18074520215071758,🔗 please ❤️,2026-01-09T04:37:08.000Z,0,kmmitschke,en,US
https://www.instagram.com/p/DSobwtFDgpn/,18106862218672965,I’m obsessed with the polka dots!!,2026-01-08T21:20:46.000Z,0,healthcoach_katie,en,US
https://www.instagram.com/p/DSobwtFDgpn/,18297115171274565,The bag,2026-01-08T18:45:42.000Z,0,annabel_elspeth_,en,US
https://www.instagram.com/p/DSobwtFDgpn/,18344386984225680,Link please!!!,2026-01-08T15:17:37.000Z,0,melissaparrinellox,en,US
https://www.instagram.com/p/DSobwtFDgpn/,18091154524795892,ashleigh,2026-01-08T14:34:15.000Z,0,ashleighmcdougallx,en,US
https://www.instagram.com/p/DSobwtFDgpn/,18551650933018563,Everything looks stunning on you,2026-01-08T08:14:13.000Z,0,emilyboos22,en,US
https://www.instagram.com/p/DSobwtFDgpn/,18402078154124233,Please can you send me the links 🔗🔗🔗,2026-01-07T16:03:08.000Z,0,emmaegilmartin,en,US
https://www.instagram.com/p/DSobwtFDgpn/,18034827833540460,That green fleece is so cute. No more clothes for me though,2026-01-07T04:40:28.000Z,0,tropicalbeans,en,US
https://www.instagram.com/p/C9TgmWayIWL/,18016164854436953,"that’s disgusting, workout at home barefoot but not in a public gym",2024-07-19T09:08:02.000Z,0,cmrrs,en,US
https://www.instagram.com/p/C9TgmWayIWL/,17932832927871125,“She got a lil butt so what”,2024-07-19T06:19:22.000Z,0,cdashlos,en,US
https://www.instagram.com/p/C9TgmWayIWL/,17920516235944117,Why being barefoot….. does it even make a difference in gains or muscle shaping? Eeeexactly 🤢🤧 keep them on please,2024-07-19T04:09:40.000Z,0,prodigy.page,en,US
https://www.instagram.com/p/C9TgmWayIWL/,18009797657542734,"Now, why couldn’t you have filmed yourself removing your sweaty sneakers and socks?🤦🏻‍♂️",2024-07-19T03:49:46.000Z,0,mrblueeyes,en,US
https://www.instagram.com/p/C9TgmWayIWL/,18025570412225341,She’s askin for MRSA,2024-07-19T03:27:28.000Z,0,sightho,en,US
https://www.instagram.com/p/C9TgmWayIWL/,18007883387540207,NOBODY IS LOOKING AT THE LEG😎💜😎,2024-07-19T03:07:31.000Z,0,theo_tjes,en,US
https://www.instagram.com/p/C9TgmWayIWL/,17932343981862688,"Wow, never seen any of these exercises!!! This girl is amazing. Did she create all these? Not",2024-07-19T02:12:56.000Z,0,daytonexpress,en,US
https://www.instagram.com/p/C9TgmWayIWL/,18039281833820381,why on earth did you have to do it barefoot??,2024-07-19T02:10:08.000Z,0,jamescbenson12,en,US
https://www.instagram.com/p/DSobwtFDgpn/,18060884045649174,I love all of them❤️❤️❤️,2026-01-07T04:38:00.000Z,0,realmomfitcheck,en,US
https://www.instagram.com/p/DSobwtFDgpn/,18293433184302657,@perfectioneyebrowstampa,2026-01-06T23:24:58.000Z,0,perfectioneyebrowstampa,en,US
https://www.instagram.com/p/DSobwtFDgpn/,17934887436119515,Love the first pair of pants,2026-01-06T20:17:40.000Z,0,chelsielynnbentley,en,US
https://www.instagram.com/p/DSobwtFDgpn/,18048501656702562,I love the hoodies!,2026-01-06T18:05:29.000Z,0,lil_mewy3,en,US
https://www.instagram.com/p/C9TgmWayIWL/,18035620151060169,Staph Infection: “Am I a joke to you?”,2024-07-19T02:03:15.000Z,0,kgcardinal139,en,US
https://www.instagram.com/p/C9TgmWayIWL/,18035972867045187,Stop looking towards the ground on your reps..look forward to avoid straining your neck and upper back !,2024-07-19T01:40:08.000Z,0,exerphys1,en,US
https://www.instagram.com/p/C9TgmWayIWL/,18066555958560659,"No bitching at anyone like you own the gym, great form... Why don't I get more of these type of reels in my FYP?",2024-07-19T00:32:38.000Z,0,instagingagram,en,US
https://www.instagram.com/p/C9TgmWayIWL/,17893693659043272,What is wrong with barefoot work out? I mean it’s not like she’s not wearing her pants on tf,2024-07-19T00:32:09.000Z,0,la.iscs,en,US
https://www.instagram.com/p/C9TgmWayIWL/,18070862110550694,🦶🏻🦶🏻 Socks off are hot 🔥 🔥 🔥 🔥 🔥 🔥 🔥,2024-07-18T23:27:00.000Z,0,infootpursuit,en,US
https://www.instagram.com/p/C9TgmWayIWL/,18123205288369313,Rawdogging the gym floor is WILD,2024-07-18T22:13:57.000Z,0,cycle_inc459,en,US
https://www.instagram.com/p/C9TgmWayIWL/,18044592139852851,Nahhhhhh!!!! Ain’t nobody wanna see them dogs in the gym,2024-07-18T21:35:36.000Z,0,a_jaddey,en,US
https://www.instagram.com/p/C9TgmWayIWL/,18017419100167184,Where's the ass? Looking just like a regular skinny girl in leggings lol,2024-07-18T21:03:24.000Z,0,gapi182,en,US
https://www.instagram.com/p/C9TgmWayIWL/,18095143843435387,Hate them Bulgarian squats,2024-07-18T20:31:47.000Z,0,kabirsohal,en,US
https://www.instagram.com/p/C9TgmWayIWL/,17873712888110322,Wait for the warts on your feet,2024-07-18T20:25:25.000Z,0,denvercousa,en,US
https://www.instagram.com/p/C9TgmWayIWL/,17992354922658975,"Filming in the gym, barefoot, and hogging the smith machine?

Getttttt tf out",2024-07-18T19:11:46.000Z,0,schwarzcp,en,US
https://www.instagram.com/p/C9TgmWayIWL/,17852614050235504,Her feet are cute stop with the hate,2024-07-18T18:58:58.000Z,0,joey_s4_,en,US
https://www.instagram.com/p/C9TgmWayIWL/,18157190962313906,You going to need more than exercise,2024-07-18T18:41:48.000Z,0,mikewho_g82,en,US
https://www.instagram.com/p/C9TgmWayIWL/,18018425141156555,Go home lil sis no one wants to be recorded in the gym. And bare feet ? Yea no go home and don’t come out your house,2024-07-18T17:58:06.000Z,0,user9877266772,en,US
https://www.instagram.com/p/C9TgmWayIWL/,18004361468627451,Thanks...need to do this!,2024-07-18T17:38:15.000Z,0,hailebekele20,en,US
